{
  "pack_id": "AET-KP-UL-SCAPULA_SOURCE-001",
  "pack_version": "0.1.0-DRAFT",
  "topic": "SCAPULA",
  "primary_entity_ids": [
    "scapula"
  ],
  "domain": "UPPER_LIMB",
  "subdomain": "PECTORAL_GIRDLE",
  "authoring_agent": "OPENAI_CHATGPT_AETERNUM_KNOWLEDGE_AUTHOR",
  "authoring_protocol": "AKAP-1.0",
  "authoring_mode": "SOURCE_GROUNDED",
  "source_ids": [
    "MORGUE-UPPER-LIMB-001"
  ],
  "source_locations": [
    "pages 4-23"
  ],
  "macro_dossiers": [
    {
      "entity_id": "scapula",
      "canonical_name": "Escápula",
      "systematic_classification": "Esqueleto apendicular superior — Cintura escapular — Osso plano par",
      "pedagogical_summary": "A escápula é um osso plano, par e de configuração aproximadamente triangular que integra a cintura escapular. Localiza-se sobre a parede posterolateral do tórax, em relação geral com as costelas superiores e médias, e funciona como uma base óssea móvel entre o tronco e o membro superior.",
      "morphological_dimensions": {
        "surfaces": [
          "costal_surface",
          "posterior_surface"
        ],
        "borders": [
          "superior_border",
          "medial_border",
          "lateral_border"
        ],
        "angles": [
          "superior_angle",
          "inferior_angle",
          "lateral_angle"
        ],
        "major_processes": [
          "scapular_spine",
          "acromion",
          "coracoid_process"
        ],
        "major_fossae": [
          "subscapular_fossa",
          "supraspinous_fossa",
          "infraspinous_fossa"
        ],
        "articular_regions": [
          "glenoid_cavity"
        ],
        "landmarks": [
          "suprascapular_notch",
          "supraglenoid_tubercle",
          "infraglenoid_tubercle",
          "neck_of_scapula",
          "spinoglenoid_notch"
        ]
      },
      "syntopic_relations": [
        "Parede torácica posterolateral (costelas 2 a 7)",
        "Clavícula (articulação acromioclavicular)",
        "Úmero (articulação glenoumeral)",
        "Espaços topográficos posteriores do ombro (espaço triangular, espaço quadrangular, intervalo triangular)"
      ],
      "clinical_vulnerabilities": [
        "Escápula alada por lesão do nervo torácico longo ou disfunção do serrátil anterior",
        "Compressão do nervo supraescapular na incisura da escápula",
        "Compressão do nervo supraescapular na incisura espinoglenoidal",
        "Instabilidade articular glenoumeral e lesões labrais"
      ],
      "cadaveric_pearls": [
        "Orientação rápida: espinha posterior, cavidade glenoidal lateral, processo coracoide anterior, ângulo inferior apontando para baixo",
        "Trajeto vásculo-nervoso na incisura escapular: artéria supraescapular passa acima do ligamento transverso superior; nervo supraescapular passa abaixo",
        "Ápice coracoide como origem conjunta do coracobraquial e cabeça curta do bíceps braquial"
      ]
    }
  ],
  "documentary_memory": [
    {
      "document_id": "DOC-SCAP-001",
      "entity_ids": [
        "scapula",
        "cintura_escapular",
        "torax",
        "costelas"
      ],
      "knowledge_dimensions": [
        "IDENTITY",
        "MORPHOLOGY",
        "LOCATION"
      ],
      "narrative_text": "A escápula é um osso plano, par e de configuração aproximadamente triangular que integra a cintura escapular. Localiza-se sobre a parede posterolateral do tórax, em relação geral com as costelas superiores e médias, e funciona como uma base óssea móvel entre o tronco e o membro superior.",
      "source_ids": [
        "MORGUE-UPPER-LIMB-001"
      ],
      "fact_candidate_ids": [
        "SCAP-SRC-F001",
        "SCAP-SRC-F002",
        "SCAP-SRC-F003",
        "SCAP-SRC-F004",
        "SCAP-SRC-F005",
        "SCAP-SRC-F006",
        "SCAP-AI-F001",
        "SCAP-AI-F002"
      ]
    },
    {
      "document_id": "DOC-SCAP-002",
      "entity_ids": [
        "scapula",
        "costal_surface",
        "posterior_surface",
        "subscapular_fossa",
        "scapular_spine",
        "supraspinous_fossa",
        "infraspinous_fossa"
      ],
      "knowledge_dimensions": [
        "MORPHOLOGY",
        "PARTS"
      ],
      "narrative_text": "A escápula apresenta duas faces principais, três bordas e três ângulos. Sua face costal ou anterior é predominantemente côncava e abriga a fossa subescapular. A face posterior é dividida pela espinha da escápula em uma fossa supraespinosa, superior, e uma fossa infraespinosa, inferior.",
      "source_ids": [
        "MORGUE-UPPER-LIMB-001"
      ],
      "fact_candidate_ids": [
        "SCAP-SRC-F009",
        "SCAP-SRC-F010",
        "SCAP-SRC-F011",
        "SCAP-SRC-F012",
        "SCAP-SRC-F013",
        "SCAP-SRC-F014",
        "SCAP-AI-F003",
        "SCAP-AI-F004",
        "SCAP-AI-F005",
        "SCAP-AI-F006",
        "SCAP-AI-F007",
        "SCAP-AI-F008",
        "SCAP-AI-F009",
        "SCAP-AI-F010",
        "SCAP-AI-F011",
        "SCAP-AI-F012",
        "SCAP-AI-F013",
        "SCAP-AI-F014",
        "SCAP-AI-F015"
      ]
    },
    {
      "document_id": "DOC-SCAP-003",
      "entity_ids": [
        "scapular_spine",
        "acromion",
        "clavicle",
        "acromioclavicular_joint"
      ],
      "knowledge_dimensions": [
        "MORPHOLOGY",
        "ARTICULATIONS"
      ],
      "narrative_text": "A espinha da escápula projeta-se posteriormente e continua lateralmente no acrômio. O acrômio forma a proeminência óssea superolateral do ombro e participa da articulação acromioclavicular por meio de sua faceta destinada à extremidade lateral da clavícula.",
      "source_ids": [
        "MORGUE-UPPER-LIMB-001"
      ],
      "fact_candidate_ids": [
        "SCAP-SRC-F007",
        "SCAP-SRC-F015",
        "SCAP-AI-F016",
        "SCAP-AI-F022"
      ]
    },
    {
      "document_id": "DOC-SCAP-004",
      "entity_ids": [
        "coracoid_process",
        "cintura_escapular",
        "axila"
      ],
      "knowledge_dimensions": [
        "MORPHOLOGY",
        "TOPOGRAPHY"
      ],
      "narrative_text": "O processo coracoide projeta-se anteriormente a partir da região superior da escápula. Constitui importante ponto de fixação muscular e ligamentar e, por isso, funciona como um marco central para compreender as relações da cintura escapular, da axila e da região anterior do ombro.",
      "source_ids": [
        "MORGUE-UPPER-LIMB-001"
      ],
      "fact_candidate_ids": [
        "SCAP-SRC-F026",
        "SCAP-SRC-F040",
        "SCAP-SRC-F041",
        "SCAP-SRC-F042",
        "SCAP-SRC-F044",
        "SCAP-SRC-F045",
        "SCAP-SRC-F046",
        "SCAP-SRC-F047",
        "SCAP-AI-F017",
        "SCAP-AI-F040",
        "SCAP-AI-F041",
        "SCAP-AI-F042",
        "SCAP-AI-F043"
      ]
    },
    {
      "document_id": "DOC-SCAP-005",
      "entity_ids": [
        "lateral_angle",
        "glenoid_cavity",
        "humerus",
        "biceps_brachii_long_head",
        "triceps_brachii_long_head",
        "supraglenoid_tubercle",
        "infraglenoid_tubercle"
      ],
      "knowledge_dimensions": [
        "ARTICULATIONS",
        "MUSCULAR_RELATIONS"
      ],
      "narrative_text": "O ângulo lateral contém a cavidade glenoidal, uma superfície articular relativamente rasa destinada à cabeça do úmero. Acima e abaixo da glenoide encontram-se, respectivamente, as regiões supraglenoidal e infraglenoidal, relacionadas às origens das cabeças longas do bíceps e do tríceps braquiais.",
      "source_ids": [
        "MORGUE-UPPER-LIMB-001"
      ],
      "fact_candidate_ids": [
        "SCAP-SRC-F008",
        "SCAP-SRC-F027",
        "SCAP-SRC-F028",
        "SCAP-SRC-F029",
        "SCAP-SRC-F038",
        "SCAP-SRC-F039",
        "SCAP-AI-F018",
        "SCAP-AI-F019",
        "SCAP-AI-F020",
        "SCAP-AI-F023",
        "SCAP-AI-F024",
        "SCAP-AI-F038",
        "SCAP-AI-F039"
      ]
    },
    {
      "document_id": "DOC-SCAP-006",
      "entity_ids": [
        "superior_border",
        "medial_border",
        "lateral_border",
        "suprascapular_notch",
        "coracoid_process",
        "teres_minor",
        "teres_major"
      ],
      "knowledge_dimensions": [
        "MORPHOLOGY",
        "TOPOGRAPHY"
      ],
      "narrative_text": "A borda superior é a mais curta das três bordas e apresenta a incisura da escápula próxima à base do processo coracoide. A borda medial orienta-se em direção à coluna vertebral e recebe inserções de músculos responsáveis pela posição e movimento da escápula. A borda lateral é mais espessa e relaciona-se com os músculos redondos e com a região glenoidal.",
      "source_ids": [
        "MORGUE-UPPER-LIMB-001"
      ],
      "fact_candidate_ids": [
        "SCAP-SRC-F017",
        "SCAP-SRC-F018",
        "SCAP-SRC-F019",
        "SCAP-SRC-F020",
        "SCAP-SRC-F021",
        "SCAP-SRC-F022",
        "SCAP-AI-F005",
        "SCAP-AI-F006",
        "SCAP-AI-F007",
        "SCAP-AI-F021",
        "SCAP-AI-F028",
        "SCAP-AI-F029",
        "SCAP-AI-F034",
        "SCAP-AI-F035",
        "SCAP-AI-F036",
        "SCAP-AI-F037"
      ]
    },
    {
      "document_id": "DOC-SCAP-007",
      "entity_ids": [
        "subscapularis",
        "supraspinatus",
        "infraspinatus",
        "teres_minor",
        "teres_major",
        "trapezius",
        "deltoid",
        "levator_scapulae",
        "rhomboid_minor",
        "rhomboid_major",
        "serratus_anterior"
      ],
      "knowledge_dimensions": [
        "MUSCULAR_RELATIONS"
      ],
      "narrative_text": "A escápula constitui um verdadeiro centro de integração muscular. Subescapular, supraespinal e infraespinal originam-se em fossas próprias da escápula. Redondo menor e redondo maior relacionam-se com a borda lateral e região do ângulo inferior. Trapézio, deltoide, levantador da escápula, romboides e serrátil anterior também apresentam importantes inserções ou origens sobre diferentes regiões do osso.",